{
  "duration": 8,
  "tempo_map": [
    {
      "beat": 0.0,
      "time": 0.0,
      "bpm": 120.0
    }
  ],
  "entities": [
    {
      "id": 0,
      "kind": "circle",
      "parent_id": null,
      "width": 1,
      "height": 1,
      "initial": {
        "x": 0.0,
        "y": 0.0,
        "rotation": 0.0,
        "scale_x": 1.0,
        "scale_y": 1.0,
        "alpha": 1.0,
        "red": 1.0,
        "green": 1.0,
        "blue": 1.0
      },
      "source": {}
    },
    {
      "id": 1,
      "kind": "circle",
      "parent_id": null,
      "width": 1,
      "height": 1,
      "initial": {
        "x": 0.0,
        "y": 0.0,
        "rotation": 0.0,
        "scale_x": 1.0,
        "scale_y": 1.0,
        "alpha": 1.0,
        "red": 1.0,
        "green": 1.0,
        "blue": 1.0
      },
      "source": {}
    },
    {
      "id": 2,
      "kind": "circle",
      "parent_id": null,
      "width": 1,
      "height": 1,
      "initial": {
        "x": 0.0,
        "y": 0.0,
        "rotation": 0.0,
        "scale_x": 1.0,
        "scale_y": 1.0,
        "alpha": 1.0,
        "red": 1.0,
        "green": 1.0,
        "blue": 1.0
      },
      "source": {}
    },
    {
      "id": 3,
      "kind": "circle",
      "parent_id": null,
      "width": 1,
      "height": 1,
      "initial": {
        "x": 0.0,
        "y": 0.0,
        "rotation": 0.0,
        "scale_x": 1.0,
        "scale_y": 1.0,
        "alpha": 1.0,
        "red": 1.0,
        "green": 1.0,
        "blue": 1.0
      },
      "source": {}
    },
    {
      "id": 4,
      "kind": "circle",
      "parent_id": null,
      "width": 1,
      "height": 1,
      "initial": {
        "x": 0.0,
        "y": 0.0,
        "rotation": 0.0,
        "scale_x": 1.0,
        "scale_y": 1.0,
        "alpha": 1.0,
        "red": 1.0,
        "green": 1.0,
        "blue": 1.0
      },
      "source": {}
    }
  ],
  "events": [
    {
      "beat": 0,
      "op": "create",
      "entity": 0,
      "duration": 0.0,
      "property": "x",
      "start": 0.0,
      "end": 0.0
    },
    {
      "beat": 0,
      "op": "create",
      "entity": 1,
      "duration": 0.0,
      "property": "x",
      "start": 0.0,
      "end": 0.0
    },
    {
      "beat": 0,
      "op": "create",
      "entity": 2,
      "duration": 0.0,
      "property": "x",
      "start": 0.0,
      "end": 0.0
    },
    {
      "beat": 0,
      "op": "create",
      "entity": 3,
      "duration": 0.0,
      "property": "x",
      "start": 0.0,
      "end": 0.0
    },
    {
      "beat": 0,
      "op": "create",
      "entity": 4,
      "duration": 0.0,
      "property": "x",
      "start": 0.0,
      "end": 0.0
    }
  ],
  "segments": [],
  "metadata": {
    "title": "Harmonic Rose / Authored execution demo",
    "origin": "authored_primitive_gallery",
    "render_profile": "mathematical-v2",
    "presentation": {
      "profile": "mathematical-v2",
      "duration": 8,
      "seed": 42,
      "hue": 0.54,
      "times": [
        0,
        8
      ],
      "controls": [
        [
          0.8,
          0.4,
          0.3,
          0.2,
          0,
          12,
          1,
          0,
          0
        ],
        [
          0.8,
          0.4,
          0.3,
          0.2,
          0,
          12,
          1,
          0,
          0
        ]
      ],
      "poses": [
        [
          0,
          0,
          0,
          1
        ],
        [
          0,
          0,
          0,
          1
        ]
      ],
      "hits": []
    }
  },
  "version": "1.0",
  "coordinate_space": "world_normalized_2d"
}